<?xml version="1.0" encoding="utf-8" standalone="no"?><artikel xmlns:xsi="http://www.w3.org/2001/XMLSchema-instance" xsi:noNamespaceSchemaLocation="saobexport.xsd">
  <meta band="33" fil="T_0185-0310.xml" hänvisning="false" spalt="T288" titel="TALANG" unik="T_0185-0083.s2ii" version="2015-04-20T11:52:13"/>
  <body>
    <STYCKE art="TALANG" hänvisning="false" id="T185_123559" startspalt="T288" unik="T_0185-0083.s2ii">
      <StorRubrik id="T185_123560">TALANG</StorRubrik>
      <b id="T185_123561"/>
      <StorKursiv id="T185_123562">talaŋ</StorKursiv>
      <StorAntikva id="T185_123563" rend="upphöjd">4</StorAntikva>
      <LitenAntikva id="T185_123564">,</LitenAntikva>
      <b id="T185_123565"/>
      <LitenAntikva id="T185_123566">r.</LitenAntikva>
      <b id="T185_123567"/>
      <LitenAntikva id="T185_123568">l.</LitenAntikva>
      <b id="T185_123569"/>
      <LitenAntikva id="T185_123570">m.;</LitenAntikva>
      <b id="T185_123571"/>
      <LitenAntikva id="T185_123572">best.</LitenAntikva>
      <b id="T185_123573"/>
      <Formstil id="T185_123574">-en</Formstil>
      <LitenAntikva id="T185_123575">;</LitenAntikva>
      <b id="T185_123576"/>
      <LitenAntikva id="T185_123577">pl.</LitenAntikva>
      <b id="T185_123578"/>
      <Formstil id="T185_123579">-er</Formstil>
      <b id="T185_123580"/>
      <LitenAntikva id="T185_123581">(</LitenAntikva>
      <Forfattarstil id="T185_123582">Kellgren</Forfattarstil>
      <b id="T185_123583"/>
      <LitenKursiv id="T185_123584">(SVS)</LitenKursiv>
      <b id="T185_123585"/>
      <LitenAntikva id="T185_123586">4:</LitenAntikva>
      <b id="T185_123587"/>
      <LitenAntikva id="T185_123588">164</LitenAntikva>
      <b id="T185_123589"/>
      <Formstil id="T185_123590">(1780)</Formstil>
      <b id="T185_123591"/>
      <LitenAntikva id="T185_123592">osv.)</LitenAntikva>
      <b id="T185_123593"/>
      <formparentes id="T185_123594">(</formparentes>
      <StorAntikva id="T185_123595">(†)</StorAntikva>
      <b id="T185_123596"/>
      <Formstil id="T185_123597">-s</Formstil>
      <b id="T185_123598"/>
      <Forfattarstil id="T185_123599">Tersmeden</Forfattarstil>
      <b id="T185_123600"/>
      <LitenKursiv id="T185_123601">Mem.</LitenKursiv>
      <b id="T185_123602"/>
      <LitenAntikva id="T185_123603">2:</LitenAntikva>
      <b id="T185_123604"/>
      <LitenAntikva id="T185_123605">280</LitenAntikva>
      <b id="T185_123606"/>
      <Formstil id="T185_123607">(</Formstil>
      <LitenKursiv id="T185_123608">c.</LitenKursiv>
      <b id="T185_123609"/>
      <Formstil id="T185_123610">1790)</Formstil>
      <LitenAntikva id="T185_123611">,</LitenAntikva>
      <b id="T185_123612"/>
      <LitenKursiv id="T185_123613">Därs.</LitenKursiv>
      <b id="T185_123614"/>
      <LitenAntikva id="T185_123615">6:</LitenAntikva>
      <b id="T185_123616"/>
      <LitenAntikva id="T185_123617">163</LitenAntikva>
      <formparentes id="T185_123618">)</formparentes>
      <LitenAntikva id="T185_123619">;</LitenAntikva>
      <b id="T185_123620"/>
      <LitenAntikva id="T185_123621">äv.</LitenAntikva>
      <b id="T185_123622"/>
      <LitenAntikva id="T185_123623">(numera</LitenAntikva>
      <b id="T185_123624"/>
      <LitenAntikva id="T185_123625">mindre</LitenAntikva>
      <b id="T185_123626"/>
      <LitenAntikva id="T185_123627">br.)</LitenAntikva>
      <b id="T185_123628"/>
      <LitenRubrik id="T185_123629">TALENT</LitenRubrik>
      <b id="T185_123630"/>
      <StorKursiv id="T185_123631" nyspalt="T289">talän</StorKursiv>
      <StorAntikva id="T185_123632" rend="upphöjd">4</StorAntikva>
      <StorKursiv id="T185_123633">t</StorKursiv>
      <b id="T185_123634"/>
      <LitenAntikva id="T185_123635">l.</LitenAntikva>
      <b id="T185_123636"/>
      <StorKursiv id="T185_123637">talaŋ</StorKursiv>
      <StorAntikva id="T185_123638" rend="upphöjd">4</StorAntikva>
      <b id="T185_123639"/>
      <LitenAntikva id="T185_123640">l.</LitenAntikva>
      <b id="T185_123641"/>
      <LitenAntikva id="T185_123642">med</LitenAntikva>
      <b id="T185_123643"/>
      <LitenAntikva id="T185_123644">mer</LitenAntikva>
      <b id="T185_123645"/>
      <LitenAntikva id="T185_123646">l.</LitenAntikva>
      <b id="T185_123647"/>
      <LitenAntikva id="T185_123648">mindre</LitenAntikva>
      <b id="T185_123649"/>
      <LitenAntikva id="T185_123650">genuint</LitenAntikva>
      <b id="T185_123651"/>
      <LitenAntikva id="T185_123652">franskt</LitenAntikva>
      <b id="T185_123653"/>
      <LitenAntikva id="T185_123654">uttal,</LitenAntikva>
      <b id="T185_123655"/>
      <LitenAntikva id="T185_123656">sbst.</LitenAntikva>
      <StorAntikva id="T185_123657" rend="upphöjd">1</StorAntikva>
      <LitenAntikva id="T185_123658">,</LitenAntikva>
      <b id="T185_123659"/>
      <LitenAntikva id="T185_123660">r.</LitenAntikva>
      <b id="T185_123661"/>
      <LitenAntikva id="T185_123662">l.</LitenAntikva>
      <b id="T185_123663"/>
      <LitenAntikva id="T185_123664">m.;</LitenAntikva>
      <b id="T185_123665"/>
      <LitenAntikva id="T185_123666">best.</LitenAntikva>
      <b id="T185_123667"/>
      <Formstil id="T185_123668">-en</Formstil>
      <LitenAntikva id="T185_123669">;</LitenAntikva>
      <b id="T185_123670"/>
      <LitenAntikva id="T185_123671">pl.</LitenAntikva>
      <b id="T185_123672"/>
      <Formstil id="T185_123673">-er</Formstil>
      <b id="T185_123674"/>
      <LitenAntikva id="T185_123675">(</LitenAntikva>
      <LitenKursiv id="T185_123676">2RARP</LitenKursiv>
      <b id="T185_123677"/>
      <LitenAntikva id="T185_123678">18:</LitenAntikva>
      <b id="T185_123679"/>
      <LitenAntikva id="T185_123680">Bil.</LitenAntikva>
      <b id="T185_123681"/>
      <LitenAntikva id="T185_123682">410</LitenAntikva>
      <b id="T185_123683"/>
      <Formstil id="T185_123684">(1751)</Formstil>
      <b id="T185_123685"/>
      <LitenAntikva id="T185_123686">osv.)</LitenAntikva>
      <b id="T185_123687"/>
      <formparentes id="T185_123688">(</formparentes>
      <StorAntikva id="T185_123689">(†)</StorAntikva>
      <b id="T185_123690"/>
      <Formstil id="T185_123691">-s</Formstil>
      <b id="T185_123692"/>
      <Forfattarstil id="T185_123693">Rodhe</Forfattarstil>
      <b id="T185_123694"/>
      <LitenKursiv id="T185_123695">Lindblom</LitenKursiv>
      <b id="T185_123696"/>
      <LitenAntikva id="T185_123697">11</LitenAntikva>
      <b id="T185_123698"/>
      <Formstil id="T185_123699">(</Formstil>
      <LitenKursiv id="T185_123700">cit.</LitenKursiv>
      <b id="T185_123701"/>
      <LitenKursiv id="T185_123702">fr.</LitenKursiv>
      <b id="T185_123703"/>
      <Formstil id="T185_123704">1764)</Formstil>
      <LitenAntikva id="T185_123705">,</LitenAntikva>
      <b id="T185_123706"/>
      <LitenKursiv id="T185_123707">BrinkmArch.</LitenKursiv>
      <b id="T185_123708"/>
      <LitenAntikva id="T185_123709">2:</LitenAntikva>
      <b id="T185_123710"/>
      <LitenAntikva id="T185_123711">461</LitenAntikva>
      <b id="T185_123712"/>
      <Formstil id="T185_123713">(1795)</Formstil>
      <formparentes id="T185_123714">)</formparentes>
      <b id="T185_123715"/>
      <formparentes id="T185_123716">(</formparentes>
      <Formstil id="T185_123717">talang</Formstil>
      <b id="T185_123718"/>
      <Formstil id="T185_123719">1780</Formstil>
      <b id="T185_123720"/>
      <LitenAntikva id="T185_123721">osv.</LitenAntikva>
      <b id="T185_123722"/>
      <Formstil id="T185_123723">talant-</Formstil>
      <b id="T185_123724"/>
      <LitenAntikva id="T185_123725">i</LitenAntikva>
      <b id="T185_123726"/>
      <LitenAntikva id="T185_123727">ssg</LitenAntikva>
      <b id="T185_123728"/>
      <Formstil id="T185_123729">1829</Formstil>
      <LitenAntikva id="T185_123730">.</LitenAntikva>
      <b id="T185_123731"/>
      <Formstil id="T185_123732">talens</Formstil>
      <LitenAntikva id="T185_123733">,</LitenAntikva>
      <b id="T185_123734"/>
      <LitenAntikva id="T185_123735">pl.</LitenAntikva>
      <b id="T185_123736"/>
      <Formstil id="T185_123737">1764</Formstil>
      <LitenAntikva id="T185_123738">.</LitenAntikva>
      <b id="T185_123739"/>
      <Formstil id="T185_123740">talent</Formstil>
      <b id="T185_123741"/>
      <Formstil id="T185_123742">1717</Formstil>
      <LitenAntikva id="T185_123743">—</LitenAntikva>
      <Formstil id="T185_123744">1976</Formstil>
      <formparentes id="T185_123745">)</formparentes>
      <b id="T185_123746"/>
      <StorAntikva id="T185_123747">[</StorAntikva>
      <LitenAntikva id="T185_123748">jfr</LitenAntikva>
      <b id="T185_123749"/>
      <LitenAntikva id="T185_123750">t.</LitenAntikva>
      <b id="T185_123751"/>
      <LitenKursiv id="T185_123752">talent</LitenKursiv>
      <LitenAntikva id="T185_123753">,</LitenAntikva>
      <b id="T185_123754"/>
      <LitenAntikva id="T185_123755">eng.</LitenAntikva>
      <b id="T185_123756"/>
      <LitenKursiv id="T185_123757">talent</LitenKursiv>
      <LitenAntikva id="T185_123758">;</LitenAntikva>
      <b id="T185_123759"/>
      <LitenAntikva id="T185_123760">av</LitenAntikva>
      <b id="T185_123761"/>
      <LitenAntikva id="T185_123762">fr.</LitenAntikva>
      <b id="T185_123763"/>
      <LitenKursiv id="T185_123764">talent</LitenKursiv>
      <LitenAntikva id="T185_123765">;</LitenAntikva>
      <b id="T185_123766"/>
      <LitenAntikva id="T185_123767">eg.</LitenAntikva>
      <b id="T185_123768"/>
      <LitenAntikva id="T185_123769">bildl.</LitenAntikva>
      <b id="T185_123770"/>
      <LitenAntikva id="T185_123771">anv.</LitenAntikva>
      <b id="T185_123772"/>
      <LitenAntikva id="T185_123773">av</LitenAntikva>
      <b id="T185_123774"/>